{
  "schema_version": "0.1.0",
  "id": "idea-kitchen-0001",
  "request": "extend my kitchen 3 m into the garden, bifold doors",
  "card_id": "card-kitchen-0001",
  "jurisdiction": "GB-ENG",
  "profile_stack": [
    { "id": "gb-eng-residential", "name": "GB-ENG Residential", "version": "1.3.0", "layer": "jurisdiction", "tier": 1, "signer": { "name": "J. Smith", "credential": "CIAT 12345", "jurisdiction": "England", "verification_level": "verified" } },
    { "id": "generic", "name": "Generic", "version": "0.9.0", "layer": "generic", "tier": null, "signer": null }
  ],
  "assumptions": [
    { "id": "as-location", "key": "jurisdiction", "text": "I assumed the house is in England", "technical_term": "Jurisdiction profile GB-ENG Residential", "value": "GB-ENG", "source": "ai_inferred", "confidence": 0.7, "verify": true, "editable": true, "source_detail": { "model": { "provider": "anthropic", "model_id": "claude-sonnet-5", "task": "idea" } } },
    { "id": "as-ceiling", "key": "ceiling_height", "text": "I assumed a 2.4 m ceiling", "technical_term": "Floor-to-ceiling height", "value": 2.4, "unit": "m", "source": "ai_inferred", "confidence": 0.6, "verify": true, "editable": true, "source_detail": { "model": { "provider": "anthropic", "model_id": "claude-sonnet-5", "task": "idea" } } },
    { "id": "as-width", "key": "extension_width", "text": "I assumed the extension is 3.2 m wide", "value": 3.2, "unit": "m", "source": "ai_inferred", "confidence": 0.6, "verify": true, "editable": true, "source_detail": { "reference": { "asset_id": "ast-kitchen-photo", "origin": "own_work", "rights_confirmed": true }, "note": "Estimated from the photo." } },
    { "id": "as-walls", "key": "wall_build_up", "text": "I assumed brick walls with a cavity and a block inner wall — the usual construction in England", "technical_term": "Brick / cavity / block", "value": "gb_cavity_brick_block", "source": "profile", "confidence": 1, "verify": false, "editable": true, "source_detail": { "profile": { "id": "gb-eng-residential", "version": "1.3.0" } } },
    { "id": "as-roof", "key": "roof_type", "text": "I assumed a pitched roof with tiles", "technical_term": "Timber trussed pitched roof, tiled", "value": "gb_pitched_tiled", "source": "profile", "confidence": 1, "verify": false, "editable": true, "source_detail": { "profile": { "id": "gb-eng-residential", "version": "1.3.0" } } }
  ],
  "options": [
    {
      "id": "opt-1",
      "label": "keeps more garden",
      "ddl_hash": "sha256:058efc6ff6537d245a888ebb92d039996b1766c4852462652bc6e8cedef17976",
      "key_numbers": [
        { "key": "added_area", "label": "Added floor area", "value": 9.6, "unit": "m²", "source": "ai_inferred", "confidence": 0.6, "verify": true },
        { "key": "kitchen_size", "label": "New kitchen size", "value": "4.0 × 5.9 m (23.6 m²)", "unit": "m", "source": "ai_inferred", "confidence": 0.6, "verify": true }
      ],
      "render": {
        "asset_id": "ast-render-kitchen-opt1-lo",
        "drawing_hash": "sha256:058efc6ff6537d245a888ebb92d039996b1766c4852462652bc6e8cedef17976",
        "resolution": "low",
        "material_basis": [
          { "material_id": "brick_facing", "basis": "description_only" },
          { "material_id": "block_inner", "basis": "description_only" },
          { "material_id": "roof_tile", "basis": "description_only" },
          { "material_id": "alu_bifold", "basis": "description_only" }
        ]
      }
    },
    {
      "id": "opt-2",
      "label": "bigger kitchen-diner",
      "ddl_hash": "sha256:a7f79acb9531a2f9f066fc0dbcb13dc37f68b1fc946935176a373196da3a0615",
      "key_numbers": [
        { "key": "added_area", "label": "Added floor area", "value": 15.6, "unit": "m²", "source": "ai_inferred", "confidence": 0.6, "verify": true },
        { "key": "kitchen_size", "label": "New kitchen size", "value": "5.2 × 6.5 m (33.8 m²)", "unit": "m", "source": "ai_inferred", "confidence": 0.6, "verify": true }
      ],
      "assumption_overrides": ["as-width"],
      "render": null
    },
    {
      "id": "opt-3",
      "label": "cheaper build",
      "ddl_hash": "sha256:804a5bf80776020840d469f00c078f595422c08662d1c5fabde38425c2ca5281",
      "key_numbers": [
        { "key": "added_area", "label": "Added floor area", "value": 12.0, "unit": "m²", "source": "ai_inferred", "confidence": 0.6, "verify": true },
        { "key": "kitchen_size", "label": "New kitchen size", "value": "4.0 × 6.5 m (26.0 m²)", "unit": "m", "source": "ai_inferred", "confidence": 0.6, "verify": true }
      ],
      "render": null
    }
  ],
  "things_to_check": [
    { "id": "ttc-depth", "text": "Rear extensions of about this depth can often be built without a planning application, but the limit depends on the type of house and any earlier extensions. Check the depth with a professional.", "rule_id": null, "option_ids": ["opt-1", "opt-2", "opt-3"] },
    { "id": "ttc-party-wall", "text": "If the new side wall is on or near the boundary, your neighbour may need to be notified before work starts.", "rule_id": null, "option_ids": ["opt-2"] }
  ],
  "marks": ["watermark.concept"],
  "teach_me_first": false,
  "cost_band": null,
  "created_at": "2026-09-15T09:30:25Z"
}
